{
  "eventId": "00000000-0000-4000-8000-000000000007",
  "seq": 4,
  "at": "2026-08-24T09:07:02.881Z",
  "rigId": "RIG-03",
  "shiftDate": "2026-08-24",
  "shiftLabel": "Morning",
  "turnFrom": "09:00",
  "operatorId": "op-a4",
  "bucket": "rig_shift_checks",
  "event": "fault_cancelled",
  "data": {
    "subsystem": "Gripper",
    "secondsCharged": 46
  }
}
