{
  "eventId": "00000000-0000-4000-8000-000000000002",
  "seq": 4418,
  "at": "2026-08-24T09:02:02.881Z",
  "rigId": "RIG-03",
  "shiftDate": "2026-08-24",
  "shiftLabel": "Morning",
  "turnFrom": "09:00",
  "operatorId": "op-a4",
  "bucket": "episodes",
  "event": "episode_discarded",
  "data": {
    "episodeId": "22222222-2222-4222-8222-222222222222",
    "durationSecs": 17
  }
}
